name,published,image_urls
"Upgrade to,and start creating with exclusive, royalty-free images.",,
A living room with a white couch and a white rug,"July 23, 2024 (UTC)",https://images.unsplash.com/photo-1721743141802-f01a0437c19b?fm=jpg&q=60&w=3000&ixlib=rb-4.0.3&ixid=M3wxMjA3fDB8MHxwaG90by1wYWdlfHx8fGVufDB8fHx8fA%3D%3D
A man holding a small white object in his hands,"July 2, 2024 (UTC)",https://images.unsplash.com/photo-1719937051230-8798ae2ebe86?fm=jpg&q=60&w=3000&ixlib=rb-4.0.3&ixid=M3wxMjA3fDB8MHxwaG90by1wYWdlfHx8fGVufDB8fHx8fA%3D%3D
A blue suv driving down a dirt road,"July 24, 2024 (UTC)",https://images.unsplash.com/photo-1721843431268-b8e380c6892f?fm=jpg&q=60&w=3000&ixlib=rb-4.0.3&ixid=M3wxMjA3fDB8MHxwaG90by1wYWdlfHx8fGVufDB8fHx8fA%3D%3D
A person holding a camera in a car,"July 18, 2024 (UTC)",https://images.unsplash.com/photo-1721332153370-56d7cc352d63?fm=jpg&q=60&w=3000&ixlib=rb-4.0.3&ixid=M3wxMjA3fDB8MHxwaG90by1wYWdlfHx8fGVufDB8fHx8fA%3D%3D
The sun is setting in the desert with mountains in the background,"July 22, 2024 (UTC)",https://images.unsplash.com/photo-1721655799196-7c50607778a9?fm=jpg&q=60&w=3000&ixlib=rb-4.0.3&ixid=M3wxMjA3fDB8MHxwaG90by1wYWdlfHx8fGVufDB8fHx8fA%3D%3D
An open door leading to a living room,"July 22, 2024 (UTC)",https://images.unsplash.com/photo-1721613884660-14099d377f02?fm=jpg&q=60&w=3000&ixlib=rb-4.0.3&ixid=M3wxMjA3fDB8MHxwaG90by1wYWdlfHx8fGVufDB8fHx8fA%3D%3D
A sunset over the ocean with a boat in the distance,"July 25, 2024 (UTC)",https://images.unsplash.com/photo-1721907270095-84e429c5bb4f?fm=jpg&q=60&w=3000&ixlib=rb-4.0.3&ixid=M3wxMjA3fDB8MHxwaG90by1wYWdlfHx8fGVufDB8fHx8fA%3D%3D
A group of people riding surfboards on top of a body of water,"July 25, 2024 (UTC)",https://images.unsplash.com/photo-1721905578473-7b0fa5b190ac?fm=jpg&q=60&w=3000&ixlib=rb-4.0.3&ixid=M3wxMjA3fDB8MHxwaG90by1wYWdlfHx8fGVufDB8fHx8fA%3D%3D
A person holding a camera in their hands,"July 2, 2024 (UTC)",https://images.unsplash.com/photo-1719937050446-a121748d4ba0?fm=jpg&q=60&w=3000&ixlib=rb-4.0.3&ixid=M3wxMjA3fDB8MHxwaG90by1wYWdlfHx8fGVufDB8fHx8fA%3D%3D
A woman holding a fire stick in her hand,"July 24, 2024 (UTC)",https://plus.unsplash.com/premium_photo-1721446379149-d8aef573bae9?fm=jpg&q=60&w=3000&ixlib=rb-4.0.3&ixid=M3wxMjA3fDB8MHxwaG90by1wYWdlfHx8fGVufDB8fHx8fA%3D%3D
A close up view of a yellow flower,"July 20, 2024 (UTC)",https://images.unsplash.com/photo-1721434144642-2dc67c630d73?fm=jpg&q=60&w=3000&ixlib=rb-4.0.3&ixid=M3wxMjA3fDB8MHxwaG90by1wYWdlfHx8fGVufDB8fHx8fA%3D%3D
A woman in a white dress and red boots,"July 25, 2024 (UTC)",https://plus.unsplash.com/premium_photo-1721808508129-ae61f840a599?fm=jpg&q=60&w=3000&ixlib=rb-4.0.3&ixid=M3wxMjA3fDB8MHxwaG90by1wYWdlfHx8fGVufDB8fHx8fA%3D%3D
An orange car parked next to a black car,"July 25, 2024 (UTC)",https://images.unsplash.com/photo-1721905126607-6700881aaa95?fm=jpg&q=60&w=3000&ixlib=rb-4.0.3&ixid=M3wxMjA3fDB8MHxwaG90by1wYWdlfHx8fGVufDB8fHx8fA%3D%3D
An island in the middle of the ocean,"July 25, 2024 (UTC)",https://images.unsplash.com/photo-1721908919515-fbda004d6548?fm=jpg&q=60&w=3000&ixlib=rb-4.0.3&ixid=M3wxMjA3fDB8MHxwaG90by1wYWdlfHx8fGVufDB8fHx8fA%3D%3D
A person holding a nintendo wii game controller,"July 18, 2024 (UTC)",https://images.unsplash.com/photo-1721332154161-847851ea188b?fm=jpg&q=60&w=3000&ixlib=rb-4.0.3&ixid=M3wxMjA3fDB8MHxwaG90by1wYWdlfHx8fGVufDB8fHx8fA%3D%3D
The sun is setting over an island in the ocean,"July 19, 2024 (UTC)",https://images.unsplash.com/photo-1721367630037-f97ef4bc9a83?fm=jpg&q=60&w=3000&ixlib=rb-4.0.3&ixid=M3wxMjA3fDB8MHxwaG90by1wYWdlfHx8fGVufDB8fHx8fA%3D%3D
the sun is setting over the water at the beach,"April 3, 2024 (UTC)",https://plus.unsplash.com/premium_photo-1712016875079-5c42a61067e2?fm=jpg&q=60&w=3000&ixlib=rb-4.0.3&ixid=M3wxMjA3fDB8MHxwaG90by1wYWdlfHx8fGVufDB8fHx8fA%3D%3D
a man standing in a field flying a kite,"March 2, 2024 (UTC)",https://plus.unsplash.com/premium_photo-1709311897767-f6ce7e1fc227?fm=jpg&q=60&w=3000&ixlib=rb-4.0.3&ixid=M3wxMjA3fDB8MHxwaG90by1wYWdlfHx8fGVufDB8fHx8fA%3D%3D
Aerial view of a field of green plants,"July 25, 2024 (UTC)",https://images.unsplash.com/photo-1721906794375-63dad7ca46a0?fm=jpg&q=60&w=3000&ixlib=rb-4.0.3&ixid=M3wxMjA3fDB8MHxwaG90by1wYWdlfHx8fGVufDB8fHx8fA%3D%3D
A white chair sitting on top of a sandy beach,"July 24, 2024 (UTC)",https://plus.unsplash.com/premium_photo-1721762404671-4fd9369690e2?fm=jpg&q=60&w=3000&ixlib=rb-4.0.3&ixid=M3wxMjA3fDB8MHxwaG90by1wYWdlfHx8fGVufDB8fHx8fA%3D%3D
An empty gas station with a blue sky in the background,"July 23, 2024 (UTC)",https://images.unsplash.com/photo-1721743775338-483edf8f846f?fm=jpg&q=60&w=3000&ixlib=rb-4.0.3&ixid=M3wxMjA3fDB8MHxwaG90by1wYWdlfHx8fGVufDB8fHx8fA%3D%3D
A person is plugging a charger into a laptop,"July 3, 2024 (UTC)",https://images.unsplash.com/photo-1720048169707-a32d6dfca0b3?fm=jpg&q=60&w=3000&ixlib=rb-4.0.3&ixid=M3wxMjA3fDB8MHxwaG90by1wYWdlfHx8fGVufDB8fHx8fA%3D%3D
A small house in the middle of a lush green forest,"July 25, 2024 (UTC)",https://images.unsplash.com/photo-1721906794508-20c3c5b60bfd?fm=jpg&q=60&w=3000&ixlib=rb-4.0.3&ixid=M3wxMjA3fDB8MHxwaG90by1wYWdlfHx8fGVufDB8fHx8fA%3D%3D
An aerial view of a beach and resort,"July 25, 2024 (UTC)",https://images.unsplash.com/photo-1721908919546-f752b776f970?fm=jpg&q=60&w=3000&ixlib=rb-4.0.3&ixid=M3wxMjA3fDB8MHxwaG90by1wYWdlfHx8fGVufDB8fHx8fA%3D%3D
